passion_id,passion_name,category,career_title,career_description,demand_level,growth_rate,key_skills,roadmap_steps,resources
p28,Psychology,Social Impact,Counselor / Psychologist,"Use your interest in human behavior to help people through counseling, therapy, and mental health support.",Very High,25%,"Psychology, Active Listening, Empathy, Communication, CBT, Assessment, Research","Step 1: Study Psychology Fundamentals (4 weeks) — Behavioral, cognitive, developmental psychology|Step 2: Pursue Formal Education (formal) — BA/MA Psychology from recognized university|Step 3: Learn Counseling Techniques (4 weeks) — CBT, person-centered therapy, active listening|Step 4: Supervised Practice (8 weeks) — Clinical internship, supervised counseling sessions|Step 5: Get Licensed/Certified (varies) — RCI registration, state licensing|Step 6: Practice & Specialize (ongoing) — Private practice, hospital, school counseling","RCI India|Coursera Psychology Courses|APA Resources|iCall (TISS Mumbai)"
p29,Volunteering,Social Impact,Social Entrepreneur / NGO Professional,"Transform your desire to help others into building organizations that create lasting social change.",High,22%,"Leadership, Project Management, Fundraising, Communication, Community Building, Impact Measurement","Step 1: Identify a Social Problem (2 weeks) — Research, community needs assessment|Step 2: Study Social Enterprise Models (3 weeks) — Non-profit, hybrid, social business|Step 3: Learn Project Management (3 weeks) — Planning, execution, monitoring frameworks|Step 4: Fundraising & Finance (3 weeks) — Grant writing, crowdfunding, CSR partnerships|Step 5: Build a Team (3 weeks) — Volunteer management, hiring, culture building|Step 6: Launch & Scale (ongoing) — Pilot program, measure impact, expand","Coursera Social Entrepreneurship|Ashoka Foundation|UnLtd India|Social Enterprise India Resources"
p30,Video Editing,Technology,Video Editor / Content Producer,"Turn your editing skills into a professional career in media production, YouTube, advertising, and film.",Very High,30%,"Adobe Premiere Pro, DaVinci Resolve, After Effects, Storytelling, Color Grading, Sound Design, Motion Graphics","Step 1: Master an Editing Tool (4 weeks) — Premiere Pro or DaVinci Resolve fundamentals|Step 2: Learn Storytelling Through Edits (3 weeks) — Pacing, narrative structure, transitions|Step 3: Color Grading (3 weeks) — Color wheels, LUTs, mood-based grading|Step 4: Sound Design (2 weeks) — Audio mixing, SFX, music selection|Step 5: Motion Graphics (3 weeks) — After Effects basics, titles, lower thirds|Step 6: Build Portfolio (4 weeks) — Edit diverse projects, create showreel|Step 7: Professional Work (ongoing) — YouTube channels, agencies, freelance platforms","Premiere Pro Essential Training|DaVinci Resolve Free Training|Film Riot YouTube|Motion Design School"
p31,Content Creation,Creative Arts,YouTuber / Video Creator,"Build your own channel, create entertaining or educational videos, and monetize your content.",Very High,40%,"Video Editing, Storytelling, SEO, Audience Engagement, Scriptwriting, YouTube Analytics, Thumbnail Design","Step 1: Choose Your Niche (2 weeks) — Decide on gaming, tech, lifestyle, or education|Step 2: Setup Gear & Software (2 weeks) — Camera, mic, lighting, OBS, Premiere Pro|Step 3: Script & Storyboard (3 weeks) — Write engaging hooks, structure videos|Step 4: Record & Edit (4 weeks) — Practice on-camera presence, learn pacing|Step 5: Master SEO & Thumbnails (3 weeks) — Keywords, click-through rates, CTR optimization|Step 6: Consistency & Growth (ongoing) — Upload weekly, engage with comments, analyze retention","YouTube Creator Academy|Think Media YouTube Channel|Skillshare Video Production"
p32,Gaming,Technology,Pro Gamer / Streamer,"Turn your gaming skills into a career by competing in esports or streaming on Twitch/YouTube.",High,35%,"Gaming Strategy, Commentary, Community Building, OBS Studio, Networking, Entertainment","Step 1: Pick a Main Game (4 weeks) — Focus on a popular competitive or entertaining game|Step 2: Stream Setup (2 weeks) — PC optimization, OBS setup, overlays, alerts|Step 3: Develop Persona (3 weeks) — Decide your stream vibe, practice commentary|Step 4: Build a Schedule (1 week) — Stream consistently on set days|Step 5: Cross-Platform Growth (4 weeks) — Post clips to TikTok, YouTube Shorts, Reels|Step 6: Network & Monetize (ongoing) — Collaborate with streamers, get sponsorships, join orgs","Twitch Creator Camp|Harris Heller Alpha Gaming|Esports Training Platforms"
p33,Social Media,Lifestyle,Instagram Influencer / Creator,"Build a massive following by sharing lifestyle, fashion, or niche content and partnering with brands.",Very High,45%,"Personal Branding, Photography, Short-Form Video, Social Media Marketing, Brand Negotiation, Networking","Step 1: Define Personal Brand (2 weeks) — Niche, aesthetics, unique value proposition|Step 2: Content Strategy (3 weeks) — Plan Reels, Stories, Carousels|Step 3: Learn Mobile Editing (2 weeks) — CapCut, Lightroom Mobile, trending audio|Step 4: Post & Analyze (4 weeks) — Post daily, study Instagram Insights, adapt|Step 5: Build Community (ongoing) — Reply to DMs, host Q&As, go live|Step 6: Brand Deals (ongoing) — Create a media kit, pitch to brands, monetize","Instagram Creators Portal|Social Media Examiner|Skillshare Personal Branding"
